{
  "format": 1,
  "name": "Cyber Neon (copy)",
  "author": "Switch Super Manager",
  "description": "Close copy of the built-in dark neon theme, to start from. The built-in themes themselves cannot be edited.",
  "extends": "cyber-neon",
  "palette": {
    "accent": "#00f0ff",
    "accent2": "#ff1379",
    "accent_deep": "#00b7c2",
    "accent_soft": "#53d8ff",
    "bg": "#100c25",
    "border": "#2c2250",
    "btn_bg": "#112c3a",
    "btn_hover_bg": "#20354a",
    "frame_strong": "#c95092",
    "input": "#090614",
    "input_hover": "#110d22",
    "line": "#3b2d62",
    "line_hover": "#5a478f",
    "logo_plate": "#100c26",
    "panel2": "#150f2e",
    "panel3": "#211a3d",
    "scroll_edge": "#00f0fe",
    "scroll_handle": "#493679",
    "surface": "#120d28",
    "text": "#e5e0ff",
    "text_dim": "#a39abd",
    "text_mute": "#706985",
    "toggle_line": "#4a4466",
    "toggle_off": "#1b1433",
    "toggle_thumb": "#8d86a3",
    "warn": "#ffd166"
  }
}
