{
  "format": 1,
  "name": "Dreamcast Grey (copy)",
  "author": "Switch Super Manager",
  "description": "Copy of the built-in light grey and orange theme, to start from.",
  "extends": "dreamcast-grey",
  "palette": {
    "accent": "#e8590c",
    "accent2": "#4d5160",
    "accent_deep": "#c24a08",
    "accent_soft": "#e8590c",
    "bg": "#e6e7ea",
    "border": "#c9ccd3",
    "btn_bg": "#ffffff",
    "btn_hover_bg": "#ffe3cf",
    "frame_strong": "#c2c6ce",
    "input": "#ffffff",
    "input_hover": "#fff7f0",
    "line": "#c2c6ce",
    "line_hover": "#ee8a43",
    "logo_plate": "#0d0d12",
    "panel2": "#f3f4f6",
    "panel3": "#e0e2e7",
    "scroll_edge": "#aab0bb",
    "scroll_handle": "#c9ccd3",
    "surface": "#fafafb",
    "text": "#26282e",
    "text_dim": "#5d616c",
    "text_mute": "#9a9ea8",
    "toggle_line": "#aab0bb",
    "toggle_off": "#d6d9df",
    "toggle_thumb": "#9a9ea8",
    "warn": "#b36b00"
  }
}
