{
  "format": 1,
  "name": "Forest",
  "author": "Switch Super Manager",
  "description": "Dark green example theme.",
  "extends": "cyber-neon",
  "palette": {
    "accent": "#7bd88f",
    "accent2": "#f2c14e",
    "accent_deep": "#4fb26a",
    "accent_soft": "#a8e6b6",
    "bg": "#10261a",
    "border": "#2e6b49",
    "btn_bg": "#1b3d2b",
    "btn_hover_bg": "#265639",
    "frame_strong": "#4a9a6b",
    "input": "#0c1d13",
    "input_hover": "#12281b",
    "line": "#2e6b49",
    "line_hover": "#4a9a6b",
    "logo_plate": "#0d1f15",
    "panel2": "#173626",
    "panel3": "#1f4631",
    "scroll_edge": "#7bd88f",
    "scroll_handle": "#2e6b49",
    "surface": "#173626",
    "text": "#e4f5ea",
    "text_dim": "#9cc7aa",
    "text_mute": "#6f9a80",
    "toggle_line": "#3d7a57",
    "toggle_off": "#173626",
    "toggle_thumb": "#9cc7aa",
    "warn": "#ffd166"
  }
}
